id,desafio_id,letra,texto,ods_diretos,ods_indiretos,profundidade,justificativa_profundidade,planejamento_pesos,ferramentas_pesos,created_at,updated_at,gs_project_id,gs_table_name
alt-muro-b,desafio-muro-que-ninguem-ve,B,"Transformar o muro em uma galeria rotativa, onde a cada bimestre um artista local ou um grupo de alunos cria uma nova pintura tematica. A curadoria e feita pelos alunos, que tambem organizam uma votacao no Instagram para escolher o proximo tema.","[""11 — Cidades e Comunidades Sustentáveis"",""16 — Paz, Justiça e Instituições Eficazes""]","[""4 — Educação de Qualidade""]",Sistêmica,"Cria um mecanismo permanente de renovacao artistica e participacao da comunidade escolar, evitando que o muro volte a ficar abandonado.","[{""etapa"":""Definir o problema e a causa raiz"",""classificacao"":""Essencial""},{""etapa"":""Definir o público-alvo"",""classificacao"":""Recomendada""},{""etapa"":""Estabelecer metas e indicadores de sucesso"",""classificacao"":""Essencial""},{""etapa"":""Levantar recursos necessários (tempo, dinheiro, materiais)"",""classificacao"":""Essencial""},{""etapa"":""Buscar parceiros e apoiadores"",""classificacao"":""Essencial""},{""etapa"":""Coletar dados e evidências"",""classificacao"":""Recomendada""},{""etapa"":""Elaborar cronograma de execução"",""classificacao"":""Essencial""},{""etapa"":""Identificar riscos e planos de contingência"",""classificacao"":""Essencial""},{""etapa"":""Planejar a comunicação/divulgação"",""classificacao"":""Essencial""},{""etapa"":""Planejar a validação com o público-alvo"",""classificacao"":""Essencial""}]","[{""ferramenta"":""Formulário de pesquisa/entrevista"",""classificacao"":""Essencial""},{""ferramenta"":""Planilha de orçamento"",""classificacao"":""Essencial""},{""ferramenta"":""Protótipo/maquete física"",""classificacao"":""Essencial""},{""ferramenta"":""Prototipagem digital (Figma, Canva etc.)"",""classificacao"":""Essencial""},{""ferramenta"":""Aplicativo ou site"",""classificacao"":""Irrelevante""},{""ferramenta"":""Rede social para divulgação"",""classificacao"":""Essencial""},{""ferramenta"":""Vídeo/pitch em vídeo"",""classificacao"":""Recomendada""},{""ferramenta"":""Cronograma de tarefas (Trello, Kanban etc.)"",""classificacao"":""Essencial""},{""ferramenta"":""Ferramenta de Inteligência Artificial"",""classificacao"":""Recomendada""},{""ferramenta"":""Parcerias institucionais (ONG, prefeitura, empresa)"",""classificacao"":""Recomendada""}]",1784234777186,1784234777186,12c315b2-ad5c-45ab-bca1-36549e202d22,hack_alternativas
alt-muro-c,desafio-muro-que-ninguem-ve,C,"Alem da galeria rotativa, instalar paineis com informacoes sobre cidadania, direitos humanos e historia do bairro. O muro ganha QR codes que direcionam para videos e podcasts gravados pelos proprios alunos, criando um museu a ceu aberto. O projeto inclui parceria com a subprefeitura para garantir a manutencao e a seguranca do espaco.","[""11 — Cidades e Comunidades Sustentáveis"",""16 — Paz, Justiça e Instituições Eficazes"",""4 — Educação de Qualidade""]","[""9 — Indústria, Inovação e Infraestrutura"",""17 — Parcerias e Meios de Implementação""]",Transformadora,"Combina arte, tecnologia e educacao em uma solucao permanente com apoio institucional formal, garantindo manutencao e ampliando o impacto educativo do espaco.","[{""etapa"":""Definir o problema e a causa raiz"",""classificacao"":""Essencial""},{""etapa"":""Definir o público-alvo"",""classificacao"":""Essencial""},{""etapa"":""Estabelecer metas e indicadores de sucesso"",""classificacao"":""Essencial""},{""etapa"":""Levantar recursos necessários (tempo, dinheiro, materiais)"",""classificacao"":""Essencial""},{""etapa"":""Buscar parceiros e apoiadores"",""classificacao"":""Essencial""},{""etapa"":""Coletar dados e evidências"",""classificacao"":""Essencial""},{""etapa"":""Elaborar cronograma de execução"",""classificacao"":""Essencial""},{""etapa"":""Identificar riscos e planos de contingência"",""classificacao"":""Essencial""},{""etapa"":""Planejar a comunicação/divulgação"",""classificacao"":""Essencial""},{""etapa"":""Planejar a validação com o público-alvo"",""classificacao"":""Essencial""}]","[{""ferramenta"":""Formulário de pesquisa/entrevista"",""classificacao"":""Essencial""},{""ferramenta"":""Planilha de orçamento"",""classificacao"":""Essencial""},{""ferramenta"":""Protótipo/maquete física"",""classificacao"":""Recomendada""},{""ferramenta"":""Prototipagem digital (Figma, Canva etc.)"",""classificacao"":""Essencial""},{""ferramenta"":""Aplicativo ou site"",""classificacao"":""Recomendada""},{""ferramenta"":""Rede social para divulgação"",""classificacao"":""Essencial""},{""ferramenta"":""Vídeo/pitch em vídeo"",""classificacao"":""Essencial""},{""ferramenta"":""Cronograma de tarefas (Trello, Kanban etc.)"",""classificacao"":""Essencial""},{""ferramenta"":""Ferramenta de Inteligência Artificial"",""classificacao"":""Recomendada""},{""ferramenta"":""Parcerias institucionais (ONG, prefeitura, empresa)"",""classificacao"":""Essencial""}]",1784234791585,1784234791585,12c315b2-ad5c-45ab-bca1-36549e202d22,hack_alternativas
alt-junina-a,desafio-festa-junina-que-quase-acabou,A,"Criar uma barraca de jogos de argolas e pescaria feita com materiais reciclados, onde as prendas sao livros e brinquedos doados. Os alunos confeccionam os jogos durante as aulas de Artes e divulgam a festa com cartazes na vizinhanca.","[""4 — Educação de Qualidade""]","[""11 — Cidades e Comunidades Sustentáveis""]",Paliativa,"Adiciona uma nova atracao pontual a festa, mas nao resolve a falta de voluntarios nem engaja os alunos mais velhos.","[{""etapa"":""Definir o problema e a causa raiz"",""classificacao"":""Essencial""},{""etapa"":""Definir o público-alvo"",""classificacao"":""Irrelevante""},{""etapa"":""Estabelecer metas e indicadores de sucesso"",""classificacao"":""Irrelevante""},{""etapa"":""Levantar recursos necessários (tempo, dinheiro, materiais)"",""classificacao"":""Essencial""},{""etapa"":""Buscar parceiros e apoiadores"",""classificacao"":""Essencial""},{""etapa"":""Coletar dados e evidências"",""classificacao"":""Irrelevante""},{""etapa"":""Elaborar cronograma de execução"",""classificacao"":""Essencial""},{""etapa"":""Identificar riscos e planos de contingência"",""classificacao"":""Irrelevante""},{""etapa"":""Planejar a comunicação/divulgação"",""classificacao"":""Essencial""},{""etapa"":""Planejar a validação com o público-alvo"",""classificacao"":""Recomendada""}]","[{""ferramenta"":""Formulário de pesquisa/entrevista"",""classificacao"":""Irrelevante""},{""ferramenta"":""Planilha de orçamento"",""classificacao"":""Irrelevante""},{""ferramenta"":""Protótipo/maquete física"",""classificacao"":""Essencial""},{""ferramenta"":""Prototipagem digital (Figma, Canva etc.)"",""classificacao"":""Essencial""},{""ferramenta"":""Aplicativo ou site"",""classificacao"":""Irrelevante""},{""ferramenta"":""Rede social para divulgação"",""classificacao"":""Essencial""},{""ferramenta"":""Vídeo/pitch em vídeo"",""classificacao"":""Irrelevante""},{""ferramenta"":""Cronograma de tarefas (Trello, Kanban etc.)"",""classificacao"":""Essencial""},{""ferramenta"":""Ferramenta de Inteligência Artificial"",""classificacao"":""Irrelevante""},{""ferramenta"":""Parcerias institucionais (ONG, prefeitura, empresa)"",""classificacao"":""Essencial""}]",1784234804785,1784234804785,12c315b2-ad5c-45ab-bca1-36549e202d22,hack_alternativas
alt-junina-b,desafio-festa-junina-que-quase-acabou,B,"Dividir a organizacao da festa em comissoes tematicas (decoracao, comidas tipicas, musica, divulgacao), cada uma liderada por um grupo de alunos de diferentes idades. As decisoes sao tomadas em assembleias abertas a toda a escola, e os pais sao convidados a participar das comissoes. A festa ganha um hotsite simples (Google Sites) com a programacao e um mapa das barracas.","[""4 — Educação de Qualidade"",""11 — Cidades e Comunidades Sustentáveis""]","[""17 — Parcerias e Meios de Implementação""]",Sistêmica,"Engaja alunos de todas as idades e pais na organizacao atraves de uma estrutura participativa, resolvendo diretamente a falta de voluntarios e o desinteresse dos mais velhos.","[{""etapa"":""Definir o problema e a causa raiz"",""classificacao"":""Essencial""},{""etapa"":""Definir o público-alvo"",""classificacao"":""Essencial""},{""etapa"":""Estabelecer metas e indicadores de sucesso"",""classificacao"":""Essencial""},{""etapa"":""Levantar recursos necessários (tempo, dinheiro, materiais)"",""classificacao"":""Essencial""},{""etapa"":""Buscar parceiros e apoiadores"",""classificacao"":""Essencial""},{""etapa"":""Coletar dados e evidências"",""classificacao"":""Recomendada""},{""etapa"":""Elaborar cronograma de execução"",""classificacao"":""Essencial""},{""etapa"":""Identificar riscos e planos de contingência"",""classificacao"":""Essencial""},{""etapa"":""Planejar a comunicação/divulgação"",""classificacao"":""Essencial""},{""etapa"":""Planejar a validação com o público-alvo"",""classificacao"":""Essencial""}]","[{""ferramenta"":""Formulário de pesquisa/entrevista"",""classificacao"":""Essencial""},{""ferramenta"":""Planilha de orçamento"",""classificacao"":""Essencial""},{""ferramenta"":""Protótipo/maquete física"",""classificacao"":""Irrelevante""},{""ferramenta"":""Prototipagem digital (Figma, Canva etc.)"",""classificacao"":""Essencial""},{""ferramenta"":""Aplicativo ou site"",""classificacao"":""Essencial""},{""ferramenta"":""Rede social para divulgação"",""classificacao"":""Essencial""},{""ferramenta"":""Vídeo/pitch em vídeo"",""classificacao"":""Recomendada""},{""ferramenta"":""Cronograma de tarefas (Trello, Kanban etc.)"",""classificacao"":""Essencial""},{""ferramenta"":""Ferramenta de Inteligência Artificial"",""classificacao"":""Recomendada""},{""ferramenta"":""Parcerias institucionais (ONG, prefeitura, empresa)"",""classificacao"":""Recomendada""}]",1784234818519,1784234818519,12c315b2-ad5c-45ab-bca1-36549e202d22,hack_alternativas
alt-junina-c,desafio-festa-junina-que-quase-acabou,C,"Transformar a festa junina em um circuito cultural que inclui a festa tradicional, um concurso de quadrilhas com pesquisas sobre a origem das dancas, uma barraca de comidas tipicas de diferentes regioes do Brasil (cada turma pesquisa uma regiao), e uma exposicao sobre a historia das festas juninas na comunidade. O evento e registrado em video e vira um documentario anual.","[""4 — Educação de Qualidade"",""11 — Cidades e Comunidades Sustentáveis"",""16 — Paz, Justiça e Instituições Eficazes""]","[""10 — Redução das Desigualdades"",""17 — Parcerias e Meios de Implementação""]",Transformadora,"Cria um evento cultural anual e documentado que resgata tradicoes, valoriza a diversidade regional brasileira e envolve toda a escola de forma permanente e escalavel.","[{""etapa"":""Definir o problema e a causa raiz"",""classificacao"":""Essencial""},{""etapa"":""Definir o público-alvo"",""classificacao"":""Essencial""},{""etapa"":""Estabelecer metas e indicadores de sucesso"",""classificacao"":""Essencial""},{""etapa"":""Levantar recursos necessários (tempo, dinheiro, materiais)"",""classificacao"":""Essencial""},{""etapa"":""Buscar parceiros e apoiadores"",""classificacao"":""Essencial""},{""etapa"":""Coletar dados e evidências"",""classificacao"":""Essencial""},{""etapa"":""Elaborar cronograma de execução"",""classificacao"":""Essencial""},{""etapa"":""Identificar riscos e planos de contingência"",""classificacao"":""Essencial""},{""etapa"":""Planejar a comunicação/divulgação"",""classificacao"":""Essencial""},{""etapa"":""Planejar a validação com o público-alvo"",""classificacao"":""Essencial""}]","[{""ferramenta"":""Formulário de pesquisa/entrevista"",""classificacao"":""Essencial""},{""ferramenta"":""Planilha de orçamento"",""classificacao"":""Essencial""},{""ferramenta"":""Protótipo/maquete física"",""classificacao"":""Recomendada""},{""ferramenta"":""Prototipagem digital (Figma, Canva etc.)"",""classificacao"":""Essencial""},{""ferramenta"":""Aplicativo ou site"",""classificacao"":""Irrelevante""},{""ferramenta"":""Rede social para divulgação"",""classificacao"":""Essencial""},{""ferramenta"":""Vídeo/pitch em vídeo"",""classificacao"":""Essencial""},{""ferramenta"":""Cronograma de tarefas (Trello, Kanban etc.)"",""classificacao"":""Essencial""},{""ferramenta"":""Ferramenta de Inteligência Artificial"",""classificacao"":""Recomendada""},{""ferramenta"":""Parcerias institucionais (ONG, prefeitura, empresa)"",""classificacao"":""Essencial""}]",1784234836834,1784234836834,12c315b2-ad5c-45ab-bca1-36549e202d22,hack_alternativas
alt-caminho-a,desafio-caminho-da-escola,A,Fazer um cartaz grande com os horarios do onibus (coletados pelos alunos ao longo de uma semana) e dicas de rotas alternativas a pe ou de carona. O cartaz fica no mural da entrada da escola e e atualizado a cada mes.,"[""11 — Cidades e Comunidades Sustentáveis""]","[""10 — Redução das Desigualdades""]",Paliativa,"Organiza informacao ja existente para ajudar no curto prazo, mas nao altera a oferta real de transporte publico nem a seguranca do trajeto.","[{""etapa"":""Definir o problema e a causa raiz"",""classificacao"":""Essencial""},{""etapa"":""Definir o público-alvo"",""classificacao"":""Essencial""},{""etapa"":""Estabelecer metas e indicadores de sucesso"",""classificacao"":""Irrelevante""},{""etapa"":""Levantar recursos necessários (tempo, dinheiro, materiais)"",""classificacao"":""Irrelevante""},{""etapa"":""Buscar parceiros e apoiadores"",""classificacao"":""Irrelevante""},{""etapa"":""Coletar dados e evidências"",""classificacao"":""Essencial""},{""etapa"":""Elaborar cronograma de execução"",""classificacao"":""Essencial""},{""etapa"":""Identificar riscos e planos de contingência"",""classificacao"":""Irrelevante""},{""etapa"":""Planejar a comunicação/divulgação"",""classificacao"":""Essencial""},{""etapa"":""Planejar a validação com o público-alvo"",""classificacao"":""Recomendada""}]","[{""ferramenta"":""Formulário de pesquisa/entrevista"",""classificacao"":""Essencial""},{""ferramenta"":""Planilha de orçamento"",""classificacao"":""Irrelevante""},{""ferramenta"":""Protótipo/maquete física"",""classificacao"":""Irrelevante""},{""ferramenta"":""Prototipagem digital (Figma, Canva etc.)"",""classificacao"":""Essencial""},{""ferramenta"":""Aplicativo ou site"",""classificacao"":""Irrelevante""},{""ferramenta"":""Rede social para divulgação"",""classificacao"":""Essencial""},{""ferramenta"":""Vídeo/pitch em vídeo"",""classificacao"":""Irrelevante""},{""ferramenta"":""Cronograma de tarefas (Trello, Kanban etc.)"",""classificacao"":""Essencial""},{""ferramenta"":""Ferramenta de Inteligência Artificial"",""classificacao"":""Irrelevante""},{""ferramenta"":""Parcerias institucionais (ONG, prefeitura, empresa)"",""classificacao"":""Irrelevante""}]",1784234849885,1784234849885,12c315b2-ad5c-45ab-bca1-36549e202d22,hack_alternativas
alt-caminho-b,desafio-caminho-da-escola,B,Criar um grupo de WhatsApp (moderado pela escola) onde pais e responsaveis que vem de carro podem oferecer caronas solidarias para alunos que moram no mesmo trajeto. Os participantes se cadastram previamente e a escola organiza os trajetos.,"[""11 — Cidades e Comunidades Sustentáveis"",""10 — Redução das Desigualdades""]","[""13 — Ação Contra a Mudança Global do Clima""]",Sistêmica,"Cria uma alternativa real de mobilidade que reduz atrasos e o tempo de deslocamento a pe, fortalecendo os lacos da comunidade escolar.","[{""etapa"":""Definir o problema e a causa raiz"",""classificacao"":""Essencial""},{""etapa"":""Definir o público-alvo"",""classificacao"":""Essencial""},{""etapa"":""Estabelecer metas e indicadores de sucesso"",""classificacao"":""Essencial""},{""etapa"":""Levantar recursos necessários (tempo, dinheiro, materiais)"",""classificacao"":""Essencial""},{""etapa"":""Buscar parceiros e apoiadores"",""classificacao"":""Essencial""},{""etapa"":""Coletar dados e evidências"",""classificacao"":""Essencial""},{""etapa"":""Elaborar cronograma de execução"",""classificacao"":""Essencial""},{""etapa"":""Identificar riscos e planos de contingência"",""classificacao"":""Essencial""},{""etapa"":""Planejar a comunicação/divulgação"",""classificacao"":""Essencial""},{""etapa"":""Planejar a validação com o público-alvo"",""classificacao"":""Recomendada""}]","[{""ferramenta"":""Formulário de pesquisa/entrevista"",""classificacao"":""Essencial""},{""ferramenta"":""Planilha de orçamento"",""classificacao"":""Essencial""},{""ferramenta"":""Protótipo/maquete física"",""classificacao"":""Irrelevante""},{""ferramenta"":""Prototipagem digital (Figma, Canva etc.)"",""classificacao"":""Essencial""},{""ferramenta"":""Aplicativo ou site"",""classificacao"":""Recomendada""},{""ferramenta"":""Rede social para divulgação"",""classificacao"":""Essencial""},{""ferramenta"":""Vídeo/pitch em vídeo"",""classificacao"":""Irrelevante""},{""ferramenta"":""Cronograma de tarefas (Trello, Kanban etc.)"",""classificacao"":""Essencial""},{""ferramenta"":""Ferramenta de Inteligência Artificial"",""classificacao"":""Irrelevante""},{""ferramenta"":""Parcerias institucionais (ONG, prefeitura, empresa)"",""classificacao"":""Recomendada""}]",1784234864596,1784234864596,12c315b2-ad5c-45ab-bca1-36549e202d22,hack_alternativas
alt-caminho-c,desafio-caminho-da-escola,C,"Combinar o mapa de horários e o grupo de caronas com um sistema de ""monitores de caminho"": alunos mais velhos acompanham os mais novos a pé em rotas seguras previamente mapeadas. A escola firma parceria com a subprefeitura para melhorar a iluminação e a sinalização no entorno. O projeto gera um relatório trimestral com dados de atrasos, que é enviado à Secretaria de Transportes.","[""11 — Cidades e Comunidades Sustentáveis"",""10 — Redução das Desigualdades"",""4 — Educação de Qualidade""]","[""16 — Paz, Justiça e Instituições Eficazes"",""13 — Ação Contra a Mudança Global do Clima""]",Transformadora,"Cria uma rede permanente de apoio mútuo entre alunos e firma parceria institucional para transformar a infraestrutura urbana, promovendo autonomia e segurança de forma duradoura.","[{""etapa"":""Definir o problema e a causa raiz"",""classificacao"":""Essencial""},{""etapa"":""Coletar dados e evidências"",""classificacao"":""Essencial""},{""etapa"":""Estabelecer metas e indicadores de sucesso"",""classificacao"":""Essencial""},{""etapa"":""Elaborar cronograma de execução"",""classificacao"":""Essencial""},{""etapa"":""Identificar riscos e planos de contingência"",""classificacao"":""Essencial""},{""etapa"":""Levantar recursos necessários (tempo, dinheiro, materiais)"",""classificacao"":""Irrelevante""},{""etapa"":""Buscar parceiros e apoiadores"",""classificacao"":""Essencial""},{""etapa"":""Planejar a validação com o público-alvo"",""classificacao"":""Essencial""},{""etapa"":""Definir o público-alvo"",""classificacao"":""Essencial""},{""etapa"":""Planejar a comunicação/divulgação"",""classificacao"":""Essencial""}]","[{""ferramenta"":""Prototipagem digital (Figma, Canva etc.)"",""classificacao"":""Essencial""},{""ferramenta"":""Formulário de pesquisa/entrevista"",""classificacao"":""Essencial""},{""ferramenta"":""Aplicativo ou site"",""classificacao"":""Irrelevante""},{""ferramenta"":""Planilha de orçamento"",""classificacao"":""Essencial""},{""ferramenta"":""Protótipo/maquete física"",""classificacao"":""Irrelevante""},{""ferramenta"":""Vídeo/pitch em vídeo"",""classificacao"":""Essencial""},{""ferramenta"":""Ferramenta de Inteligência Artificial"",""classificacao"":""Recomendada""},{""ferramenta"":""Rede social para divulgação"",""classificacao"":""Essencial""},{""ferramenta"":""Cronograma de tarefas (Trello, Kanban etc.)"",""classificacao"":""Irrelevante""},{""ferramenta"":""Parcerias institucionais (ONG, prefeitura, empresa)"",""classificacao"":""Essencial""}]",1784235124633,1784235124633,12c315b2-ad5c-45ab-bca1-36549e202d22,hack_alternativas
alt-rio-c,desafio-rio-que-o-progresso-escondeu,C,"Criar um comitê intersetorial permanente, liderado pelos alunos, com representantes da prefeitura, universidades, empresas, ONGs ambientais e associações de moradores. O comitê desenvolve um plano diretor de revitalização em fases: diagnóstico participativo, limpeza, implantação de jardins filtrantes, restauração da mata ciliar com espécies nativas, criação de um aplicativo de monitoramento da qualidade da água (alimentado por sensores de baixo custo construídos pelos alunos), programa de educação ambiental nas escolas da região, e um festival anual ""Viva o Córrego"". O financiamento é misto: orçamento público, emendas parlamentares, patrocínios e crowdfunding. O projeto é documentado e disponibilizado como modelo replicável para outras cidades.","[""6 — Água Potável e Saneamento"",""11 — Cidades e Comunidades Sustentáveis"",""13 — Ação Contra a Mudança Global do Clima"",""14 — Vida na Água"",""15 — Vida Terrestre""]","[""3 — Saúde e Bem-Estar"",""4 — Educação de Qualidade"",""9 — Indústria, Inovação e Infraestrutura"",""17 — Parcerias e Meios de Implementação"",""12 — Consumo e Produção Responsáveis""]",Transformadora,"Estabelece uma governança permanente e multissetorial que ataca as causas estruturais da degradação do córrego, com monitoramento contínuo e potencial de replicação em outras cidades.","[{""etapa"":""Definir o problema e a causa raiz"",""classificacao"":""Essencial""},{""etapa"":""Coletar dados e evidências"",""classificacao"":""Essencial""},{""etapa"":""Estabelecer metas e indicadores de sucesso"",""classificacao"":""Essencial""},{""etapa"":""Elaborar cronograma de execução"",""classificacao"":""Essencial""},{""etapa"":""Identificar riscos e planos de contingência"",""classificacao"":""Essencial""},{""etapa"":""Levantar recursos necessários (tempo, dinheiro, materiais)"",""classificacao"":""Essencial""},{""etapa"":""Buscar parceiros e apoiadores"",""classificacao"":""Essencial""},{""etapa"":""Planejar a validação com o público-alvo"",""classificacao"":""Essencial""},{""etapa"":""Definir o público-alvo"",""classificacao"":""Essencial""},{""etapa"":""Planejar a comunicação/divulgação"",""classificacao"":""Essencial""}]","[{""ferramenta"":""Prototipagem digital (Figma, Canva etc.)"",""classificacao"":""Essencial""},{""ferramenta"":""Formulário de pesquisa/entrevista"",""classificacao"":""Essencial""},{""ferramenta"":""Aplicativo ou site"",""classificacao"":""Essencial""},{""ferramenta"":""Planilha de orçamento"",""classificacao"":""Essencial""},{""ferramenta"":""Protótipo/maquete física"",""classificacao"":""Essencial""},{""ferramenta"":""Vídeo/pitch em vídeo"",""classificacao"":""Essencial""},{""ferramenta"":""Ferramenta de Inteligência Artificial"",""classificacao"":""Essencial""},{""ferramenta"":""Rede social para divulgação"",""classificacao"":""Essencial""},{""ferramenta"":""Cronograma de tarefas (Trello, Kanban etc.)"",""classificacao"":""Essencial""},{""ferramenta"":""Parcerias institucionais (ONG, prefeitura, empresa)"",""classificacao"":""Recomendada""}]",1784235124650,1784235124650,12c315b2-ad5c-45ab-bca1-36549e202d22,hack_alternativas
alt-rio-a,desafio-rio-que-o-progresso-escondeu,A,"Organizar um grande mutirão de limpeza das margens do córrego no trecho ainda visível, com a participação de voluntários da comunidade, escolas e escoteiros. O evento seria registrado em vídeo e fotos, e uma carta com os resultados seria enviada à prefeitura pedindo manutenção periódica.","[""6 — Água Potável e Saneamento"",""14 — Vida na Água""]","[""11 — Cidades e Comunidades Sustentáveis"",""3 — Saúde e Bem-Estar""]",Paliativa,"Resolve o problema visível de forma pontual e imediata, sem alterar a infraestrutura ou as causas estruturais da poluição do córrego.","[{""etapa"":""Definir o problema e a causa raiz"",""classificacao"":""Essencial""},{""etapa"":""Coletar dados e evidências"",""classificacao"":""Essencial""},{""etapa"":""Estabelecer metas e indicadores de sucesso"",""classificacao"":""Recomendada""},{""etapa"":""Elaborar cronograma de execução"",""classificacao"":""Essencial""},{""etapa"":""Identificar riscos e planos de contingência"",""classificacao"":""Recomendada""},{""etapa"":""Levantar recursos necessários (tempo, dinheiro, materiais)"",""classificacao"":""Irrelevante""},{""etapa"":""Buscar parceiros e apoiadores"",""classificacao"":""Essencial""},{""etapa"":""Planejar a validação com o público-alvo"",""classificacao"":""Essencial""},{""etapa"":""Definir o público-alvo"",""classificacao"":""Essencial""},{""etapa"":""Planejar a comunicação/divulgação"",""classificacao"":""Essencial""}]","[{""ferramenta"":""Prototipagem digital (Figma, Canva etc.)"",""classificacao"":""Essencial""},{""ferramenta"":""Formulário de pesquisa/entrevista"",""classificacao"":""Recomendada""},{""ferramenta"":""Aplicativo ou site"",""classificacao"":""Irrelevante""},{""ferramenta"":""Planilha de orçamento"",""classificacao"":""Recomendada""},{""ferramenta"":""Protótipo/maquete física"",""classificacao"":""Essencial""},{""ferramenta"":""Vídeo/pitch em vídeo"",""classificacao"":""Essencial""},{""ferramenta"":""Ferramenta de Inteligência Artificial"",""classificacao"":""Irrelevante""},{""ferramenta"":""Rede social para divulgação"",""classificacao"":""Essencial""},{""ferramenta"":""Cronograma de tarefas (Trello, Kanban etc.)"",""classificacao"":""Irrelevante""},{""ferramenta"":""Parcerias institucionais (ONG, prefeitura, empresa)"",""classificacao"":""Recomendada""}]",1784235124653,1784235124653,12c315b2-ad5c-45ab-bca1-36549e202d22,hack_alternativas
