id,desafio_id,letra,texto,ods_diretos,ods_indiretos,profundidade,justificativa_profundidade,planejamento_pesos,ferramentas_pesos,created_at,updated_at,gs_project_id,gs_table_name
alt-patrimonio-desaba-a,desafio-patrimonio-que-desaba,A,Criar um roteiro turístico pelo centro histórico com alunos atuando como guias.,"[""11 — Cidades e Comunidades Sustentáveis"",""4 — Educação de Qualidade""]","[""8 — Trabalho Decente e Crescimento Econômico""]",Paliativa,"Dá visibilidade turística ao centro histórico, mas não resolve a falta de manutenção dos prédios nem a pressão imobiliária sobre os moradores antigos.","[{""etapa"":""Definir o problema e a causa raiz"",""classificacao"":""Essencial""},{""etapa"":""Definir o público-alvo"",""classificacao"":""Recomendada""},{""etapa"":""Estabelecer metas e indicadores de sucesso"",""classificacao"":""Irrelevante""},{""etapa"":""Levantar recursos necessários (tempo, dinheiro, materiais)"",""classificacao"":""Essencial""},{""etapa"":""Buscar parceiros e apoiadores"",""classificacao"":""Recomendada""},{""etapa"":""Coletar dados e evidências"",""classificacao"":""Essencial""},{""etapa"":""Elaborar cronograma de execução"",""classificacao"":""Essencial""},{""etapa"":""Identificar riscos e planos de contingência"",""classificacao"":""Irrelevante""},{""etapa"":""Planejar a comunicação/divulgação"",""classificacao"":""Essencial""},{""etapa"":""Planejar a validação com o público-alvo"",""classificacao"":""Recomendada""}]","[{""ferramenta"":""Formulário de pesquisa/entrevista"",""classificacao"":""Essencial""},{""ferramenta"":""Planilha de orçamento"",""classificacao"":""Irrelevante""},{""ferramenta"":""Protótipo/maquete física"",""classificacao"":""Irrelevante""},{""ferramenta"":""Prototipagem digital (Figma, Canva etc.)"",""classificacao"":""Recomendada""},{""ferramenta"":""Aplicativo ou site"",""classificacao"":""Irrelevante""},{""ferramenta"":""Rede social para divulgação"",""classificacao"":""Essencial""},{""ferramenta"":""Vídeo/pitch em vídeo"",""classificacao"":""Recomendada""},{""ferramenta"":""Cronograma de tarefas (Trello, Kanban etc.)"",""classificacao"":""Essencial""},{""ferramenta"":""Ferramenta de Inteligência Artificial"",""classificacao"":""Irrelevante""},{""ferramenta"":""Parcerias institucionais (ONG, prefeitura, empresa)"",""classificacao"":""Recomendada""}]",1784243858775,1784243858775,12c315b2-ad5c-45ab-bca1-36549e202d22,hack_alternativas
alt-patrimonio-desaba-b,desafio-patrimonio-que-desaba,B,Museu Vivo: roteiro turístico + centro cultural nos prédios recuperados + oficinas de restauro com a comunidade.,"[""11 — Cidades e Comunidades Sustentáveis"",""4 — Educação de Qualidade"",""8 — Trabalho Decente e Crescimento Econômico"",""16 — Paz, Justiça e Instituições Eficazes""]","[""10 — Redução das Desigualdades""]",Sistêmica,"Une preservação física, geração de renda e capacitação técnica da comunidade em restauro, criando um circuito cultural sustentável que envolve os próprios moradores.","[{""etapa"":""Definir o problema e a causa raiz"",""classificacao"":""Essencial""},{""etapa"":""Definir o público-alvo"",""classificacao"":""Essencial""},{""etapa"":""Estabelecer metas e indicadores de sucesso"",""classificacao"":""Recomendada""},{""etapa"":""Levantar recursos necessários (tempo, dinheiro, materiais)"",""classificacao"":""Essencial""},{""etapa"":""Buscar parceiros e apoiadores"",""classificacao"":""Essencial""},{""etapa"":""Coletar dados e evidências"",""classificacao"":""Recomendada""},{""etapa"":""Elaborar cronograma de execução"",""classificacao"":""Essencial""},{""etapa"":""Identificar riscos e planos de contingência"",""classificacao"":""Essencial""},{""etapa"":""Planejar a comunicação/divulgação"",""classificacao"":""Essencial""},{""etapa"":""Planejar a validação com o público-alvo"",""classificacao"":""Recomendada""}]","[{""ferramenta"":""Formulário de pesquisa/entrevista"",""classificacao"":""Essencial""},{""ferramenta"":""Planilha de orçamento"",""classificacao"":""Essencial""},{""ferramenta"":""Protótipo/maquete física"",""classificacao"":""Recomendada""},{""ferramenta"":""Prototipagem digital (Figma, Canva etc.)"",""classificacao"":""Recomendada""},{""ferramenta"":""Aplicativo ou site"",""classificacao"":""Recomendada""},{""ferramenta"":""Rede social para divulgação"",""classificacao"":""Essencial""},{""ferramenta"":""Vídeo/pitch em vídeo"",""classificacao"":""Essencial""},{""ferramenta"":""Cronograma de tarefas (Trello, Kanban etc.)"",""classificacao"":""Essencial""},{""ferramenta"":""Ferramenta de Inteligência Artificial"",""classificacao"":""Irrelevante""},{""ferramenta"":""Parcerias institucionais (ONG, prefeitura, empresa)"",""classificacao"":""Essencial""}]",1784243858794,1784243858794,12c315b2-ad5c-45ab-bca1-36549e202d22,hack_alternativas
alt-patrimonio-desaba-c,desafio-patrimonio-que-desaba,C,Distrito Criativo Patrimonial: museu vivo + fomento à economia criativa local + políticas públicas de preservação com permanência dos moradores.,"[""11 — Cidades e Comunidades Sustentáveis"",""4 — Educação de Qualidade"",""8 — Trabalho Decente e Crescimento Econômico"",""16 — Paz, Justiça e Instituições Eficazes"",""17 — Parcerias e Meios de Implementação""]","[""10 — Redução das Desigualdades"",""12 — Consumo e Produção Responsáveis"",""9 — Indústria, Inovação e Infraestrutura""]",Transformadora,"Combina preservação patrimonial, economia criativa e política habitacional em um plano integrado que garante o direito à moradia dos antigos moradores junto com a revitalização do centro histórico.","[{""etapa"":""Definir o problema e a causa raiz"",""classificacao"":""Essencial""},{""etapa"":""Definir o público-alvo"",""classificacao"":""Essencial""},{""etapa"":""Estabelecer metas e indicadores de sucesso"",""classificacao"":""Essencial""},{""etapa"":""Levantar recursos necessários (tempo, dinheiro, materiais)"",""classificacao"":""Essencial""},{""etapa"":""Buscar parceiros e apoiadores"",""classificacao"":""Essencial""},{""etapa"":""Coletar dados e evidências"",""classificacao"":""Essencial""},{""etapa"":""Elaborar cronograma de execução"",""classificacao"":""Essencial""},{""etapa"":""Identificar riscos e planos de contingência"",""classificacao"":""Essencial""},{""etapa"":""Planejar a comunicação/divulgação"",""classificacao"":""Essencial""},{""etapa"":""Planejar a validação com o público-alvo"",""classificacao"":""Essencial""}]","[{""ferramenta"":""Formulário de pesquisa/entrevista"",""classificacao"":""Essencial""},{""ferramenta"":""Planilha de orçamento"",""classificacao"":""Essencial""},{""ferramenta"":""Protótipo/maquete física"",""classificacao"":""Recomendada""},{""ferramenta"":""Prototipagem digital (Figma, Canva etc.)"",""classificacao"":""Essencial""},{""ferramenta"":""Aplicativo ou site"",""classificacao"":""Essencial""},{""ferramenta"":""Rede social para divulgação"",""classificacao"":""Essencial""},{""ferramenta"":""Vídeo/pitch em vídeo"",""classificacao"":""Essencial""},{""ferramenta"":""Cronograma de tarefas (Trello, Kanban etc.)"",""classificacao"":""Essencial""},{""ferramenta"":""Ferramenta de Inteligência Artificial"",""classificacao"":""Recomendada""},{""ferramenta"":""Parcerias institucionais (ONG, prefeitura, empresa)"",""classificacao"":""Essencial""}]",1784243858793,1784243858793,12c315b2-ad5c-45ab-bca1-36549e202d22,hack_alternativas
alt-refugiados-invisiveis-a,desafio-refugiados-invisiveis,A,Oficina de português: aulas gratuitas ministradas por voluntários da comunidade.,"[""4 — Educação de Qualidade"",""10 — Redução das Desigualdades""]","[""16 — Paz, Justiça e Instituições Eficazes""]",Paliativa,"Reduz a barreira linguística de forma pontual, mas não resolve a validação de diplomas nem a discriminação no mercado de trabalho.","[{""etapa"":""Definir o problema e a causa raiz"",""classificacao"":""Essencial""},{""etapa"":""Definir o público-alvo"",""classificacao"":""Recomendada""},{""etapa"":""Estabelecer metas e indicadores de sucesso"",""classificacao"":""Irrelevante""},{""etapa"":""Levantar recursos necessários (tempo, dinheiro, materiais)"",""classificacao"":""Essencial""},{""etapa"":""Buscar parceiros e apoiadores"",""classificacao"":""Recomendada""},{""etapa"":""Coletar dados e evidências"",""classificacao"":""Irrelevante""},{""etapa"":""Elaborar cronograma de execução"",""classificacao"":""Essencial""},{""etapa"":""Identificar riscos e planos de contingência"",""classificacao"":""Irrelevante""},{""etapa"":""Planejar a comunicação/divulgação"",""classificacao"":""Essencial""},{""etapa"":""Planejar a validação com o público-alvo"",""classificacao"":""Recomendada""}]","[{""ferramenta"":""Formulário de pesquisa/entrevista"",""classificacao"":""Recomendada""},{""ferramenta"":""Planilha de orçamento"",""classificacao"":""Irrelevante""},{""ferramenta"":""Protótipo/maquete física"",""classificacao"":""Irrelevante""},{""ferramenta"":""Prototipagem digital (Figma, Canva etc.)"",""classificacao"":""Recomendada""},{""ferramenta"":""Aplicativo ou site"",""classificacao"":""Irrelevante""},{""ferramenta"":""Rede social para divulgação"",""classificacao"":""Essencial""},{""ferramenta"":""Vídeo/pitch em vídeo"",""classificacao"":""Irrelevante""},{""ferramenta"":""Cronograma de tarefas (Trello, Kanban etc.)"",""classificacao"":""Essencial""},{""ferramenta"":""Ferramenta de Inteligência Artificial"",""classificacao"":""Irrelevante""},{""ferramenta"":""Parcerias institucionais (ONG, prefeitura, empresa)"",""classificacao"":""Recomendada""}]",1784243894128,1784243894128,12c315b2-ad5c-45ab-bca1-36549e202d22,hack_alternativas
alt-refugiados-invisiveis-b,desafio-refugiados-invisiveis,B,"Portal de Oportunidades: site com vagas de emprego, cursos e rede de apoio para refugiados.","[""10 — Redução das Desigualdades"",""8 — Trabalho Decente e Crescimento Econômico"",""4 — Educação de Qualidade"",""16 — Paz, Justiça e Instituições Eficazes""]","[""17 — Parcerias e Meios de Implementação""]",Sistêmica,"Cria um canal contínuo que conecta refugiados a oportunidades reais de trabalho e formação, indo além do ensino da língua para atacar a inclusão econômica.","[{""etapa"":""Definir o problema e a causa raiz"",""classificacao"":""Essencial""},{""etapa"":""Definir o público-alvo"",""classificacao"":""Essencial""},{""etapa"":""Estabelecer metas e indicadores de sucesso"",""classificacao"":""Recomendada""},{""etapa"":""Levantar recursos necessários (tempo, dinheiro, materiais)"",""classificacao"":""Essencial""},{""etapa"":""Buscar parceiros e apoiadores"",""classificacao"":""Essencial""},{""etapa"":""Coletar dados e evidências"",""classificacao"":""Recomendada""},{""etapa"":""Elaborar cronograma de execução"",""classificacao"":""Recomendada""},{""etapa"":""Identificar riscos e planos de contingência"",""classificacao"":""Essencial""},{""etapa"":""Planejar a comunicação/divulgação"",""classificacao"":""Essencial""},{""etapa"":""Planejar a validação com o público-alvo"",""classificacao"":""Recomendada""}]","[{""ferramenta"":""Formulário de pesquisa/entrevista"",""classificacao"":""Essencial""},{""ferramenta"":""Planilha de orçamento"",""classificacao"":""Recomendada""},{""ferramenta"":""Protótipo/maquete física"",""classificacao"":""Irrelevante""},{""ferramenta"":""Prototipagem digital (Figma, Canva etc.)"",""classificacao"":""Essencial""},{""ferramenta"":""Aplicativo ou site"",""classificacao"":""Essencial""},{""ferramenta"":""Rede social para divulgação"",""classificacao"":""Essencial""},{""ferramenta"":""Vídeo/pitch em vídeo"",""classificacao"":""Recomendada""},{""ferramenta"":""Cronograma de tarefas (Trello, Kanban etc.)"",""classificacao"":""Essencial""},{""ferramenta"":""Ferramenta de Inteligência Artificial"",""classificacao"":""Irrelevante""},{""ferramenta"":""Parcerias institucionais (ONG, prefeitura, empresa)"",""classificacao"":""Essencial""}]",1784243894135,1784243894135,12c315b2-ad5c-45ab-bca1-36549e202d22,hack_alternativas
alt-refugiados-invisiveis-c,desafio-refugiados-invisiveis,C,Rede Integrar: portal de oportunidades + centro de acolhimento físico + articulação de políticas públicas de integração.,"[""10 — Redução das Desigualdades"",""16 — Paz, Justiça e Instituições Eficazes"",""8 — Trabalho Decente e Crescimento Econômico"",""4 — Educação de Qualidade"",""17 — Parcerias e Meios de Implementação"",""1 — Erradicação da Pobreza""]","[""3 — Saúde e Bem-Estar"",""5 — Igualdade de Gênero""]",Transformadora,"Cria uma rede completa de acolhimento físico, digital e institucional, capaz de virar referência nacional de política de integração de refugiados, indo muito além de ações pontuais.","[{""etapa"":""Definir o problema e a causa raiz"",""classificacao"":""Essencial""},{""etapa"":""Definir o público-alvo"",""classificacao"":""Essencial""},{""etapa"":""Estabelecer metas e indicadores de sucesso"",""classificacao"":""Essencial""},{""etapa"":""Levantar recursos necessários (tempo, dinheiro, materiais)"",""classificacao"":""Essencial""},{""etapa"":""Buscar parceiros e apoiadores"",""classificacao"":""Essencial""},{""etapa"":""Coletar dados e evidências"",""classificacao"":""Essencial""},{""etapa"":""Elaborar cronograma de execução"",""classificacao"":""Essencial""},{""etapa"":""Identificar riscos e planos de contingência"",""classificacao"":""Essencial""},{""etapa"":""Planejar a comunicação/divulgação"",""classificacao"":""Essencial""},{""etapa"":""Planejar a validação com o público-alvo"",""classificacao"":""Essencial""}]","[{""ferramenta"":""Formulário de pesquisa/entrevista"",""classificacao"":""Essencial""},{""ferramenta"":""Planilha de orçamento"",""classificacao"":""Essencial""},{""ferramenta"":""Protótipo/maquete física"",""classificacao"":""Recomendada""},{""ferramenta"":""Prototipagem digital (Figma, Canva etc.)"",""classificacao"":""Essencial""},{""ferramenta"":""Aplicativo ou site"",""classificacao"":""Essencial""},{""ferramenta"":""Rede social para divulgação"",""classificacao"":""Essencial""},{""ferramenta"":""Vídeo/pitch em vídeo"",""classificacao"":""Essencial""},{""ferramenta"":""Cronograma de tarefas (Trello, Kanban etc.)"",""classificacao"":""Essencial""},{""ferramenta"":""Ferramenta de Inteligência Artificial"",""classificacao"":""Recomendada""},{""ferramenta"":""Parcerias institucionais (ONG, prefeitura, empresa)"",""classificacao"":""Essencial""}]",1784243894130,1784243894130,12c315b2-ad5c-45ab-bca1-36549e202d22,hack_alternativas
alt-jardim-morreu-c,desafio-jardim-que-morreu,C,"Montar um clube permanente que cuida do jardim, produz compostagem com os restos de comida da cantina e vende mudas e flores para a comunidade. A renda é revertida para a manutenção do jardim e para outras melhorias na escola. O clube também oferece oficinas de jardinagem para outras turmas.","[""15 — Vida Terrestre"",""12 — Consumo e Produção Responsáveis"",""4 — Educação de Qualidade"",""8 — Trabalho Decente e Crescimento Econômico""]","[""11 — Cidades e Comunidades Sustentáveis"",""17 — Parcerias e Meios de Implementação""]",Transformadora,"Cria uma estrutura permanente e autossustentável financeiramente, que gera renda própria, ensina compostagem e jardinagem para toda a escola e se conecta à comunidade por meio da venda de mudas.","[{""etapa"":""Definir o problema e a causa raiz"",""classificacao"":""Essencial""},{""etapa"":""Definir o público-alvo"",""classificacao"":""Essencial""},{""etapa"":""Estabelecer metas e indicadores de sucesso"",""classificacao"":""Essencial""},{""etapa"":""Levantar recursos necessários (tempo, dinheiro, materiais)"",""classificacao"":""Essencial""},{""etapa"":""Buscar parceiros e apoiadores"",""classificacao"":""Essencial""},{""etapa"":""Coletar dados e evidências"",""classificacao"":""Essencial""},{""etapa"":""Elaborar cronograma de execução"",""classificacao"":""Essencial""},{""etapa"":""Identificar riscos e planos de contingência"",""classificacao"":""Essencial""},{""etapa"":""Planejar a comunicação/divulgação"",""classificacao"":""Essencial""},{""etapa"":""Planejar a validação com o público-alvo"",""classificacao"":""Essencial""}]","[{""ferramenta"":""Formulário de pesquisa/entrevista"",""classificacao"":""Essencial""},{""ferramenta"":""Planilha de orçamento"",""classificacao"":""Essencial""},{""ferramenta"":""Protótipo/maquete física"",""classificacao"":""Recomendada""},{""ferramenta"":""Prototipagem digital (Figma, Canva etc.)"",""classificacao"":""Recomendada""},{""ferramenta"":""Aplicativo ou site"",""classificacao"":""Irrelevante""},{""ferramenta"":""Rede social para divulgação"",""classificacao"":""Essencial""},{""ferramenta"":""Vídeo/pitch em vídeo"",""classificacao"":""Recomendada""},{""ferramenta"":""Cronograma de tarefas (Trello, Kanban etc.)"",""classificacao"":""Essencial""},{""ferramenta"":""Ferramenta de Inteligência Artificial"",""classificacao"":""Irrelevante""},{""ferramenta"":""Parcerias institucionais (ONG, prefeitura, empresa)"",""classificacao"":""Essencial""}]",1784243972777,1784243972777,12c315b2-ad5c-45ab-bca1-36549e202d22,hack_alternativas
alt-jardim-morreu-a,desafio-jardim-que-morreu,A,"Organizar um dia de plantio com mudas doadas pelos pais e comerciantes locais. Cada turma fica responsável por um canteiro, e um calendário de rega é distribuído entre os alunos voluntários.","[""15 — Vida Terrestre""]","[""4 — Educação de Qualidade""]",Paliativa,"Revive o jardim com um mutirão pontual e doações, mas depende do esforço voluntário contínuo dos alunos e não resolve a falta de verba ou de rotina estruturada de manutenção.","[{""etapa"":""Definir o problema e a causa raiz"",""classificacao"":""Essencial""},{""etapa"":""Definir o público-alvo"",""classificacao"":""Recomendada""},{""etapa"":""Estabelecer metas e indicadores de sucesso"",""classificacao"":""Irrelevante""},{""etapa"":""Levantar recursos necessários (tempo, dinheiro, materiais)"",""classificacao"":""Essencial""},{""etapa"":""Buscar parceiros e apoiadores"",""classificacao"":""Essencial""},{""etapa"":""Coletar dados e evidências"",""classificacao"":""Irrelevante""},{""etapa"":""Elaborar cronograma de execução"",""classificacao"":""Essencial""},{""etapa"":""Identificar riscos e planos de contingência"",""classificacao"":""Irrelevante""},{""etapa"":""Planejar a comunicação/divulgação"",""classificacao"":""Essencial""},{""etapa"":""Planejar a validação com o público-alvo"",""classificacao"":""Recomendada""}]","[{""ferramenta"":""Formulário de pesquisa/entrevista"",""classificacao"":""Irrelevante""},{""ferramenta"":""Planilha de orçamento"",""classificacao"":""Irrelevante""},{""ferramenta"":""Protótipo/maquete física"",""classificacao"":""Irrelevante""},{""ferramenta"":""Prototipagem digital (Figma, Canva etc.)"",""classificacao"":""Essencial""},{""ferramenta"":""Aplicativo ou site"",""classificacao"":""Irrelevante""},{""ferramenta"":""Rede social para divulgação"",""classificacao"":""Recomendada""},{""ferramenta"":""Vídeo/pitch em vídeo"",""classificacao"":""Irrelevante""},{""ferramenta"":""Cronograma de tarefas (Trello, Kanban etc.)"",""classificacao"":""Essencial""},{""ferramenta"":""Ferramenta de Inteligência Artificial"",""classificacao"":""Irrelevante""},{""ferramenta"":""Parcerias institucionais (ONG, prefeitura, empresa)"",""classificacao"":""Recomendada""}]",1784243972779,1784243972779,12c315b2-ad5c-45ab-bca1-36549e202d22,hack_alternativas
alt-jardim-morreu-b,desafio-jardim-que-morreu,B,"Criar um sistema de irrigação por gotejamento usando garrafas PET e mangueiras recicladas. A água é liberada lentamente, mantendo o solo úmido sem desperdício. Os alunos aprendem sobre reuso de materiais e economia de água durante a construção.","[""15 — Vida Terrestre"",""12 — Consumo e Produção Responsáveis"",""6 — Água Potável e Saneamento""]","[""4 — Educação de Qualidade""]",Sistêmica,Resolve a causa raiz da dependência de rega manual constante ao criar um sistema automático e sustentável de irrigação feito com material reciclado.,"[{""etapa"":""Definir o problema e a causa raiz"",""classificacao"":""Essencial""},{""etapa"":""Definir o público-alvo"",""classificacao"":""Essencial""},{""etapa"":""Estabelecer metas e indicadores de sucesso"",""classificacao"":""Recomendada""},{""etapa"":""Levantar recursos necessários (tempo, dinheiro, materiais)"",""classificacao"":""Essencial""},{""etapa"":""Buscar parceiros e apoiadores"",""classificacao"":""Recomendada""},{""etapa"":""Coletar dados e evidências"",""classificacao"":""Essencial""},{""etapa"":""Elaborar cronograma de execução"",""classificacao"":""Recomendada""},{""etapa"":""Identificar riscos e planos de contingência"",""classificacao"":""Essencial""},{""etapa"":""Planejar a comunicação/divulgação"",""classificacao"":""Essencial""},{""etapa"":""Planejar a validação com o público-alvo"",""classificacao"":""Recomendada""}]","[{""ferramenta"":""Formulário de pesquisa/entrevista"",""classificacao"":""Recomendada""},{""ferramenta"":""Planilha de orçamento"",""classificacao"":""Recomendada""},{""ferramenta"":""Protótipo/maquete física"",""classificacao"":""Essencial""},{""ferramenta"":""Prototipagem digital (Figma, Canva etc.)"",""classificacao"":""Recomendada""},{""ferramenta"":""Aplicativo ou site"",""classificacao"":""Irrelevante""},{""ferramenta"":""Rede social para divulgação"",""classificacao"":""Recomendada""},{""ferramenta"":""Vídeo/pitch em vídeo"",""classificacao"":""Irrelevante""},{""ferramenta"":""Cronograma de tarefas (Trello, Kanban etc.)"",""classificacao"":""Essencial""},{""ferramenta"":""Ferramenta de Inteligência Artificial"",""classificacao"":""Irrelevante""},{""ferramenta"":""Parcerias institucionais (ONG, prefeitura, empresa)"",""classificacao"":""Recomendada""}]",1784243972792,1784243972792,12c315b2-ad5c-45ab-bca1-36549e202d22,hack_alternativas
alt-quadro-nao-apaga-a,desafio-quadro-que-nao-apaga,A,Organizar uma vaquinha entre os alunos para comprar um kit de canetas novas e produtos de limpeza adequados. Os próprios alunos criam uma escala de limpeza do quadro ao final de cada dia.,"[""4 — Educação de Qualidade""]","[""9 — Indústria, Inovação e Infraestrutura""]",Paliativa,"Resolve o problema temporariamente com a compra de materiais novos e uma escala de limpeza, mas depende de repor os materiais periodicamente e não elimina a causa raiz.","[{""etapa"":""Definir o problema e a causa raiz"",""classificacao"":""Essencial""},{""etapa"":""Definir o público-alvo"",""classificacao"":""Irrelevante""},{""etapa"":""Estabelecer metas e indicadores de sucesso"",""classificacao"":""Irrelevante""},{""etapa"":""Levantar recursos necessários (tempo, dinheiro, materiais)"",""classificacao"":""Essencial""},{""etapa"":""Buscar parceiros e apoiadores"",""classificacao"":""Irrelevante""},{""etapa"":""Coletar dados e evidências"",""classificacao"":""Irrelevante""},{""etapa"":""Elaborar cronograma de execução"",""classificacao"":""Essencial""},{""etapa"":""Identificar riscos e planos de contingência"",""classificacao"":""Irrelevante""},{""etapa"":""Planejar a comunicação/divulgação"",""classificacao"":""Essencial""},{""etapa"":""Planejar a validação com o público-alvo"",""classificacao"":""Recomendada""}]","[{""ferramenta"":""Formulário de pesquisa/entrevista"",""classificacao"":""Irrelevante""},{""ferramenta"":""Planilha de orçamento"",""classificacao"":""Recomendada""},{""ferramenta"":""Protótipo/maquete física"",""classificacao"":""Irrelevante""},{""ferramenta"":""Prototipagem digital (Figma, Canva etc.)"",""classificacao"":""Recomendada""},{""ferramenta"":""Aplicativo ou site"",""classificacao"":""Irrelevante""},{""ferramenta"":""Rede social para divulgação"",""classificacao"":""Essencial""},{""ferramenta"":""Vídeo/pitch em vídeo"",""classificacao"":""Irrelevante""},{""ferramenta"":""Cronograma de tarefas (Trello, Kanban etc.)"",""classificacao"":""Essencial""},{""ferramenta"":""Ferramenta de Inteligência Artificial"",""classificacao"":""Irrelevante""},{""ferramenta"":""Parcerias institucionais (ONG, prefeitura, empresa)"",""classificacao"":""Irrelevante""}]",1784244007373,1784244007373,12c315b2-ad5c-45ab-bca1-36549e202d22,hack_alternativas
